{
  "id": "gcb:org:g-rune-publishing",
  "name": "G. Rune Publishing",
  "entity_type": "organization",
  "status": "active",
  "description": "Publishing and intellectual property entity within the GCB ecosystem.",
  "roles": [
    "publisher",
    "ip-owner",
    "rights-anchor"
  ],
  "affiliations": [
    "gcb:brand:g-films"
  ],
  "wallets": [
    {
      "chain": "solana",
      "address": "REPLACE_WITH_G_RUNE_WALLET",
      "label": "primary-onchain-identity"
    }
  ],
  "domains": [
    {
      "type": "sns",
      "value": "REPLACE_WITH_G_RUNE_SOL"
    }
  ],
  "links": {
    "website": "REPLACE_WITH_WEBSITE",
    "github": "REPLACE_WITH_GITHUB"
  },
  "metadata": {
    "notes": [
      "Canonical parent publishing entity for early registry scaffold."
    ]
  },
  "version": "0.1.0",
  "created_at": "2026-04-23",
  "updated_at": "2026-04-23"
}