{
  "id": "gcb:person:giganiga",
  "name": "Giganiga",
  "entity_type": "person",
  "status": "active",
  "description": "Founder-level identity record for the GCB ecosystem scaffold. The Epic is true.",
  "roles": [
    "founder",
    "author",
    "architect"
  ],
  "affiliations": [
    "gcb:org:g-rune-publishing",
    "gcb:brand:g-films"
  ],
  "wallets": [
    {
      "chain": "solana",
      "address": "REPLACE_WITH_PRIMARY_WALLET",
      "label": "founder-wallet"
    }
  ],
  "domains": [],
  "links": {
    "github": "REPLACE_WITH_GITHUB",
    "youtube": "REPLACE_WITH_YOUTUBE",
    "website": "REPLACE_WITH_WEBSITE"
  },
  "metadata": {
    "display_name": "Dr. Justin Goldston"
  },
  "version": "0.1.0",
  "created_at": "2026-04-23",
  "updated_at": "2026-04-23"
}